Title,Date,Location,Text,URL
Überraschung bei der Unfallaufnahme,04.06.2025,"Wehrhain, Elbe-Elster","Rettungsdienst und Polizei waren am Dienstag kurz nach 18:00 Uhr zum Verkehrsunfall auf der Bundesstraße zwischen Wehrhain und Naundorf gefragt. Nach einer Vorfahrtmissachtung war ein PKW VW so heftig gegen einen PKW JEEP geprallt, dass beide Fahrzeuge anschließend bei geschätzten 20.000 Euro Sachschaden nicht mehr fahrbereit waren und die Fahrbahn für etwa eine Stunde gesperrt werden musste.
Beide Fahrer im Alter von 49 und 50 Jahren verletzten sich infolge des Aufpralls und wurden zur medizinischen Behandlung in Krankenhäuser gebracht. Zuvor wurde beim Tiguan-Nutzer ein Atemalkoholtest durchgeführt, welcher einen Wert von 0,79 Promille ergab. Für ihn wurde neben der medizinischen Untersuchung auch eine Blutentnahme veranlasst und ein Ermittlungsverfahren eingeleitet.",https://polizei.brandenburg.de/pressemeldung/ueberraschung-bei-der-unfallaufnahme/5601358
Einbruch misslungen,04.06.2025,"Bad Liebenwerda, Elbe-Elster","Die Angestellte eines Frisörsalons in der Mittelstraße bemerkte während der Reinigung am Dienstagmittag Hebelspuren an einem Fenster und verständigte die Polizei
.
Die Beamten bestätigten vor Ort den Verdacht. Ein Eindringen in das Objekt gelang allerdings nicht. Die Ermittlungen wurden aufgenommen.",https://polizei.brandenburg.de/pressemeldung/einbruch-misslungen/5601353
Nach Streit um Parkplatz zur Polizeiwache,04.06.2025,"Großräschen, Oberspreewald-Lausitz","Ein Streit um einen Parkplatz ist am Dienstagnachmittag in der Anselm-Feuerbach-Straße eskaliert. Ein Mann hatte sein Auto auf einem Anwohnerparkplatz abgestellt. Als der Berechtigte ihn darauf hinwies, gab es den Aussagen zufolge erst eine verbale Auseinandersetzung, die in einem Schlag ins Gesicht mündete.
Die hinzugerufenen Beamten stellten fest, dass der Autofahrer per Haftbefehl gesucht wurde und nahmen ihn zunächst mit aufs Revier. Nachdem Bekannte den offenen Geldbetrag beglichen hatten und der Haftgrund damit entfiel, konnte der 27-Jährige die Räume der Polizei verlassen und die Fahndung gelöscht werden.",https://polizei.brandenburg.de/pressemeldung/nach-streit-um-parkplatz-zur-polizeiwach/5601345
Hausfriedensbruch,04.06.2025,"Klettwitz, Oberspreewald-Lausitz","Ein Grundstücksbesitzer meldete sich am Dienstagnachmittag bei der Polizei, weil er unerwünschten Besuch auf dem Gehöft hatte. Ein Wohnungsloser hatte sich auf seinem Grundstück einquartiert und schraubte in einer Garage an Fahrrädern herum. Die Beamten fanden den 20-Jährigen schlafend vor und auch diverse Fahrradteile, unter anderem einen Rahmen, der in Fahndung stand. Deshalb beschlagnahmten sie ihn.
Außerdem stellten die Polizisten fest, dass der Mann am gleichen Tag einen Gerichtstermin nicht wahrgenommen hatte und brachten ihn zur Richterin, die Untersuchungshaft anordnete. Er wurde anschließend in eine entsprechende Einrichtung gebracht.",https://polizei.brandenburg.de/pressemeldung/hausfriedensbruch/5601339
Fahrraddiebstähle im Stadtgebiet,04.06.2025,"Senftenberg, Oberspreewald-Lausitz","Der Polizei wurden im Laufe des Dienstagnachmittags mehrere Fahrraddiebstähle im Stadtgebiet gemeldet. In der
Seeadlerstraße
entfernten Unbekannte ein E-Bike, das vor dem Haus angekettet war.
Ein ähnliches Bild bot sich in der
Wilhelm-Pieck-Straße
. Nach beiden Rädern wird nun gefahndet.",https://polizei.brandenburg.de/pressemeldung/fahrraddiebstaehle-im-stadtgebiet/5601344
Einbrecher im Strandbad,04.06.2025,"Zeesen, Dahme-Spreewald","Das Strandbad in der Uferstraße war in den frühen Morgenstunden des Dienstages das Ziel von Dieben, wie der Polizei am Nachmittag angezeigt wurde. Die Eingangstür des Kassenhäuschens war aufgebrochen worden, um daraus Bargeld, Getränke und Süßigkeiten zu stehlen.
Die genaue Höhe der verursachten Schäden ist nun wie auch der Tathergang Gegenstand kriminalpolizeilicher Ermittlungen. In deren Rahmen wurden Spuren und Beweismittel gesichert.",https://polizei.brandenburg.de/pressemeldung/einbrecher-im-strandbad/5601321
Blechschäden,04.06.2025,"Döbern, Spree-Neiße","Auf der Forster Straße sind am Dienstagabend gegen 19:00 Uhr ein PKW SKODA und ein VW zusammengestoßen. Verletzt wurde dabei niemand und auch die Autos blieben mit Schäden von etwa 2.000 Euro fahrbereit.
Da der SKODA-Fahrer die Unfallstelle verlassen hatte und erst durch die Ermittlungen der Polizei ausfindig gemacht werden konnte, wurde ein Strafverfahren wegen einer Verkehrsunfallflucht eingeleitet.",https://polizei.brandenburg.de/pressemeldung/blechschaeden/5601314
Fahrrad gestohlen und wiedergefunden,04.06.2025,"Drebkau, Spree-Neiße","Ein Mann aus Drebkau hat sich am Dienstag gegen 17:20 Uhr an die Polizei gewandt, da er Hinweise zu seinem gestohlenen Fahrrad hatte. Am Morgen war sein weißes E-Bike in der Schiebelstraße verschwunden. Am Nachmittag konnte er es dann im Ausbau Golschow orten.
Die Polizisten stellten das Fahrrad dort fest und sicherten Spuren, bevor der rechtmäßigen Eigentümer dieses wieder an sich nehmen konnte.",https://polizei.brandenburg.de/pressemeldung/fahrrad-gestohlen-und-wiedergefunden/5601312
Bei Anlagengeschäften betrogen,04.06.2025,"Karstädt/Wittenberge, Prignitz","Gleich mehrere Personen sind in den vergangenen Tagen von bisher Unbekannten mit der Aussicht auf hohe Gewinne bei Geldanlagen betrogen worden. Am Montag meldeten sich eine 65-jährige und ein 77-jähriger Geschädigter bei der Polizei und erstatteten Anzeigen. In beiden Fällen waren durch die Täter Anlagemöglichkeiten beworben worden, welche durch eine Einzahlung Gewinn erzielen sollten. In einem Fall wurde ein mittlerer fünfstelliger Euro-Betrag überwiesen, zu einer Gewinnausschüttung kam es jedoch nie. Im zweiten Fall fiel der Schwindel schneller auf, hier beläuft sich der Schaden nur auf 250 Euro.",https://polizei.brandenburg.de/pressemeldung/bei-anlagengeschaeften-betrogen/5601289
Blitzersäule beschmiert,04.06.2025,"Historische Innenstadt, Breite Straße, Potsdam",Durch eine Streifenwagenbesatzung konnte in den frühen Morgenstunden ein Graffito an einer Blitzersäule in der Breiten Straße festgestellt werden. Dabei hatten bislang unbekannte Tatverdächtige mit einem Stift Buchstaben auf die Säule geschrieben. Der Schaden wurde fotografiert und eine Spurensuche durchgeführt. Die für den Blitzer verantwortliche Behörde wurde in Kenntnis gesetzt. Ein Strafverfahren wegen Sachbeschädigung wurde eingeleitet.,https://polizei.brandenburg.de/pressemeldung/blitzersaeule-beschmiert/5601244
Betrug im letzten Moment verhindert,04.06.2025,"Brandenburger Vorstadt, Potsdam","In Potsdam konnte am Dienstag ein Betrug mit einer bekannten Betrugsmasche im letzten Moment verhindert und damit ein hoher Schaden vermieden werden. Die Tochter einer Seniorin hatte am Dienstagnachmittag die Polizei gerufen, weil unbekannte Betrüger offenbar versucht hatten von ihrer 90-jährigen Mutter 20.000 Euro zu erbeuten. Dazu wurde in einem Telefonat behauptet, dass die Enkelin einen Verkehrsunfall gehabt hätte und sie nun eine Kaution zu zahlen habe, um die Enkelin aus der vermeintlichen Haft zu holen. Als die 90-Jährige schließlich bereits bei ihrer Bank war, um das Geld vom Konto abzuheben, fiel der aufmerksamen Bank-Mitarbeiterin die Betrugshandlung auf, sodass eine Geldübergabe verhindert werden konnte. Ein Ermittlungsverfahren wurde eingeleitet.",https://polizei.brandenburg.de/pressemeldung/betrug-im-letzten-moment-verhindert/5601241
Diebstahl aus Schuppen,04.06.2025,"Neustadt, Neustädtische Fischerstraße, Brandenburg an der Havel",Durch den Geschädigten wurde die Polizei über einen Einbruch Informiert. Die unbekannten Täter gelangten über das frei zugängliche Grundstück zu einem Schuppen und brachen diesen mit Gewalt auf. Ersten Erkenntnissen zur Folge wurde ein Elektrogerät entwendet. Durch die Polizei wurde vor Ort eine kriminaltechnische Spurensuche und Spurensicherung durchgeführt.  Die weiteren Ermittlungen führt die Kriminalpolizei.,https://polizei.brandenburg.de/pressemeldung/diebstahl-aus-schuppen/5601200
Polizei im Einsatz,04.06.2025,"Frankfurt (Oder), Frankfurt (Oder)","Am Abend des 03.06.2025 wurden Polizisten in Richtung des Pablo-Neruda-Blocks gerufen. Gegen 20:30 Uhr waren dort mehrere Personen in eine verbale Auseinandersetzung geraten und hatte ein 35-jähriger russischer Staatsbürger schlichtend eingreifen wollen. Der musste dann jedoch erleben, wie einer der Beteiligten ihn mit einer Getränkedose bewarf. Die traf sein Gesicht und hinterließ Verletzungen, welche später von Rettungskräften behandelt wurden.
Die alarmierten Polizisten stellten den Tatverdächtigen, der sich wehrte und die Beamten beschimpfte und beleidigte. Letztlich fand sich der 31-Jährige aber doch im festen Griff wieder. Der Marokkaner hatte zu diesem Zeitpunkt einen Atemalkoholwert von 1,33 Promille aufzuweisen. Die kommenden Stunden verbrachte der Delinquent im polizeilichen Gewahrsam, wo er seinen Rausch ausschlafen konnte. Dennoch wird zum Vorwurf der gefährlichen Körperverletzung ermittelt.",https://polizei.brandenburg.de/pressemeldung/polizei-im-einsatz/5601146
Betrüger bleiben am Ball,04.06.2025,"Frankfurt (Oder), Frankfurt (Oder)","Im Tagesverlauf des 03.06.2025 meldeten sich gleich zwei Betroffene bei der Polizei, um ihre Erfahrungen mit Betrügern zu schildern und das Ganze auch anzuzeigen.
So traf es einen Rentner, der über Wochen immer wieder Geld an noch Unbekannte überwies, die ihm vorgegaukelt hatten, dass sie dieses Kapital um ein Vielfaches vermehren könnten. Er war zuvor über eine Internetseite auf diese angeblich lukrative Geldvermehrung aufmerksam geworden und musste nun erkennen, Betrügern aufgesessen zu sein.
Im anderen Fall hatte am Vormittag des 03.06.2025 das Telefon eines 80 Jahre alten Mannes geklingelt. Dem wurde im nun folgenden Gespräch suggeriert, glücklicher Gewinner von 38.000 Euro zu sein, die aber nur ausgezahlt werden könnten, wenn er Apple Cards im Wert von 1.000 Euro besorgen würde. Und sobald deren Codes übermittelt worden seien, gehören die ganzen 38.000 Euro ihm…
Glücklicherweise geriet der Mann später an kundige Verkäufer derartiger Karten. Die gaben ihm zu verstehen, dass es sich um eine Betrugsmasche handele und er ja nicht darauf hereinfallen solle. Dem kann die Polizei nur zustimmen und hoffentlich erinnern sich künftige potentielle Gewinner an genau diesen Fall, wenn bei ihnen das Telefon klingelt!",https://polizei.brandenburg.de/pressemeldung/betrueger-bleiben-am-ball/5601145
Ermittlungen laufen,04.06.2025,"Dahlwitz-Hoppegarten und Erkner, Überregional","Am 03.06.2025 wurden Polizisten gegen 23:10 Uhr zu einem Firmengelände in der Handwerkerstraße in Dahlwitz-Hoppegarten (LK Märkisch-Oderland) gerufen. Waren dort doch mehrere Personen gesichtet worden, die sich an Baumaschinen zu schaffen machten. Als Funkwagen am mutmaßlichen Tatort eintrafen, flüchteten zwei Gestalten über einen Zaun und verschwanden erst einmal unerkannt.  Wie sich herausstellte, hatten sie sich mit brachialer Gewalt Zutritt zum Grundstück verschafft und dann Zubehör für Mini-Bagger zusammengerafft. Das Ganze aber auch mitzunehmen, schafften sie durch das Auftauchen der Polizei nicht mehr.
Bei Fahndungsmaßnahmen stach einer Funkwagenbesatzung im Bereich der B1 bei Hoppegarten ein Mercedes ins Auge, der offenbar mit zwei Personen besetzt war. Von Anhaltesignalen ließ sich der Fahrer des Autos nicht beeindrucken. Vielmehr beschleunigte er den Mercedes und raste damit davon. Doch geriet das Fahrzeug dabei in die Alte Berliner Straße und damit in eine Sackgasse. Auch jetzt blieb der Fluchtgedanken scheinbar oberste Prämisse der Insassen. Das führte dazu, dass der Mercedes gewendet und dann der Funkwagen aus dem Weg gerammt wurde. Dadurch erlitten zwei Polizisten Verletzungen. Sie mussten später von Rettungskräften versorgt werden. Der Funkwagen ist vorerst nicht mehr einsetzbar.
In der Waldpromenade in Erkner (LK Oder-Spree) entdeckte eine weitere Funkwagenbesatzung gegen 02:10 Uhr schließlich besagten Mercedes, der dort abgestellt worden war. Von den Insassen war nichts zu sehen, aber passende Unfallschäden ließen keinen Zweifel aufkommen, dass man das richtige Fahrzeug vor sich hatte.
Nun galt es, das Umfeld genauer unter die Lupe zu nehmen. Und tatsächlich gerieten dabei zwei junge Männer ins Sichtfeld, die den Drosselsteg in Richtung Woltersdorfer Landstraße entlang rannten. Da sie sichtlich bemüht schienen, mit der Polizei nicht in Kontakt zu treten, war schnell klar, dass man es hier wohl mit den Gesuchten zu tun hatte. Letztlich fand sich das Duo im festen Griff von Polizisten wieder. So kam heraus, dass man es mit zwei 18 und 22 Jahre alten Deutschen zu tun hatte, die schon polizeilich bekannt waren. Da sie zudem den Schlüssel des Mercedes bei sich hatten, wird zumindest ein Leugnen hinsichtlich des Verkehrsunfalls in Hoppegarten nicht viel bringen. Ob sie auch etwas mit dem Tatgeschehen in der Handwerkerstraße in Dahlwitz-Hoppegarten zu tun hatten, muss jedoch noch ermittelt werden. Zudem wird geprüft, ob die Delinquenten im Bereich der Drogenkriminalität aktiv wurden. Fanden sich bei ihnen doch mutmaßliche Betäubungsmittel und Geld in szenetypischer Stückelung. Da auch der Verdacht bestand, dass beide Herren unter Drogeneinfluss stehen könnten, mussten sie jeweils eine Blutprobe lassen.",https://polizei.brandenburg.de/pressemeldung/ermittlungen-laufen/5601141
Seine Fahrweise verriet ihn,04.06.2025,"BAB 11, Barnim","Am Abend des 03.06.2025 meldete sich ein aufmerksamer Verkehrsteilnehmer bei der Polizei, um mitzuteilen, dass zwischen Lanke und Finowfurt ein Fiat 500 in Schlangenlinien unterwegs sei. Kurz vor der Anschlussstelle Finowfurt konnte der Wagen dann auch ausgemacht und angehalten werden. Am Steuer hatte ein 18- Jähriger gesessen, der recht ungehalten reagierte. So fand er sich alsbald am Boden und in Handfesseln wieder. Tatsächlich konnte der junge Mann einen Atemalkoholwert von 0,79 Promille aufweisen. Wie sich zudem herausstellte, gehörte der Fiat gar nicht ihm, sondern war ihm von einem „Kumpel“ mit der Maßgabe übergeben worden, das Auto nach Polen zu bringen. Der Wagen ist weiteren Ermittlungen zufolge im Landkreis Märkisch-Oderland durch Diebstahl abhandengekommen. Mit diesem Wissen klickten Handfesseln und wird der polnische Staatsbürger nun auch Kriminalisten gegenübersitzen.",https://polizei.brandenburg.de/pressemeldung/seine-fahrweise-verriet-ihn/5601140
Ermittlungen eingeleitet,04.06.2025,"Bernau b. Berlin, Barnim","Am 03.06.2025 wandte sich ein junger Mann gegen 22:30 Uhr an die Polizei, nachdem er in der Lohmühlenstraße von einem anderen jungen Mann vom Fahrrad gezogen und geschlagen worden war. Er konnte sich zwar der Situation entziehen, doch war ihm dabei sein Mobiltelefon aus der Tasche gefallen. Der Schläger nahm sowohl Telefon als auch Fahrrad mit sich.
Später konnte derjenige jedoch ausgemacht und angehalten werden. Das Fahrrad wurde ihm abgenommen. Wo das Telefon abgeblieben ist, muss jedoch noch geklärt werden. Der 18-jähriger Iraner sieht nun einem Ermittlungsverfahren entgegen.",https://polizei.brandenburg.de/pressemeldung/ermittlungen-eingeleitet/5601139
Garage aufgebrochen,04.06.2025,"Schwedt/Oder, Uckermark","Wie der Polizei am 04.06.2025 angezeigt wurde, haben sich noch Unbekannte an einer Garage in der Fritz-Krumbach-Straße zu schaffen gemacht. Letztlich gelangten sie auch in das Objekt. Ob ihnen dabei etwas in die Hände fiel, war bei der Anzeigenaufnahme aber noch nicht zu ergründen gewesen. Die Kriminalpolizei ermittelt in dem Fall.",https://polizei.brandenburg.de/pressemeldung/garage-aufgebrochen/5601136
Heckscheibe beschädigt,03.06.2025,"Kleinmachnow, Adolf-Grimme-Ring, Potsdam-Mittelmark","Am Montagabend meldete sich eine Fahrzeughalterin und teilte mit, dass von ihrem abgestellten Fahrzeug die Heckscheibe beschädigt wurde. Bei ersten Ermittlungen vor Ort konnte im Fahrzeuginnenraum ein kleiner Gegenstand festgestellt werden, welcher ursächlich für die Beschädigung gewesen sein könnte. Dieser wurde als Beweismittel sichergestellt. Es wurde eine Anzeige aufgenommen. Die Ermittlungen der Kriminalpolizei dauern an.",https://polizei.brandenburg.de/pressemeldung/heckscheibe-beschaedigt/5600579
Sachbeschädigung an PKW,03.06.2025,"Großbeerenstraße, Potsdam","Am Vormittag beobachtete ein aufmerksamer Zeuge eine männliche Person, welche von mehreren abgestellten Fahrzeugen die Seitenspiegel abschlug. Der Passant konnte den Tatverdächtigen bis zum Eintreffen der verständigten Polizeibeamten vor Ort festhalten. Im Rahmen der Anzeigenaufnahme konnten insgesamt drei beschädigte Fahrzeuge festgestellt werden. Alle Geschädigten wurden zum Tatgeschehen informiert. Eine Motivlage zum Handeln des Beschuldigten ließen sich vor Ort nicht erkennen. Ein Strafverfahren wurde eingeleitet.",https://polizei.brandenburg.de/pressemeldung/sachbeschaedigung-an-pkw/5600574
Frau in Ausnahmezustand greift Rettungskräfte an,03.06.2025,"Ludwigfelde, Nord, Teltow-Fläming","Zeugen alarmierten am Dienstagmorgen die Polizei über eine Frau, welche sich in ihrer Wohnung offenbar in einem psychischen Ausnahmezustand befindet. Als die Polizisten, gemeinsam mit Rettungskräften an die Frau herantraten bzw. ansprachen griff diese unmittelbar die Beamten an du warf Gegenstände. Um weitere Angriffe abzuwehren wendeten die Beamten einfache körperliche Gewalt an und brachten die Frau zu Boden gebracht. Dabei wurde ein Beamter leicht an der Hand verletzte. Ein Notarzt verfügte anschließend die Einweisung der Frau in Fachklinik. Der verletzte Beamte blieb weiterhin dienstfähig. Zwei sich in der Wohnung befindliche Kinder wurden kurze Zeit später dem in Trennung lebenden Vater übergeben. Die Polizei hat nun Ermittlungen wegen Widerstand gegen Vollstreckungsbeamte eingeleitet.",https://polizei.brandenburg.de/pressemeldung/frau-in-ausnahmezustand-greift-rettungsk/5600564
Nach Verkehrskontrolle zur Blutprobe,03.06.2025,"Finsterwalde, Elbe-Elster","Zur Blutprobe musste eine VW-Fahrerin Polizeibeamte am Dienstagmorgen begleiten. Die Beamten hatten das Auto gegen 08:45 Uhr auf der Schulstraße für eine Verkehrskontrolle gestoppt.
Ein Drogentest bei der Frau hatte angezeigt, dass sie unter dem Einfluss Amphetaminen und Opiaten stand. Ihr wurde im Anschluss die Weiterfahrt untersagt.",https://polizei.brandenburg.de/pressemeldung/nach-verkehrskontrolle-zur-blutprobe/5600513
Alkoholisierter E-Roller-Fahrer verletzt,03.06.2025,"Falkenberg, Elbe-Elster","Ein verletzter E-Roller-Fahrer ist Zeugen am Montagabend gegen 20:00 Uhr auf der Liebenwerdaer Straße aufgefallen. Gegenüber den hinzugerufenen Polizisten hatte der 36-Jährige angegeben, von einem Auto angefahren worden zu sein. Daher leiteten die Beamten umgehend Ermittlungen zu dem beschriebenen grünen PKW wegen dem Verdacht einer Unfallflucht ein.
Da der Verletzte jedoch auch erheblich alkoholisiert war, ein entsprechende hatte einen Wert von über 2,5 Promille angezeigt, wurde ebenfalls ein Strafverfahren gegen ihn eingeleitet. Zur Sicherung von Beweisen wurde dafür eine Blutprobe veranlasst.",https://polizei.brandenburg.de/pressemeldung/alkoholisierter-e-roller-fahrer-verletzt/5600502
E-Roller-Fahrer unter Drogenverdacht,03.06.2025,"Bad Liebenwerda, Elbe-Elster","Zwischen Bad Liebenwerda und Lausitz stoppten Polzisten am Montag gegen 14:30 Uhr ein E-Roller für eine Verkehrskontrolle, da dieser ohne Versicherungskennzeichen unterwegs war. Ein Drogentest bei dem Fahrer zeigte zusätzlich an, dass der Mann offensichtlich unter dem Einfluss von Amphetaminen stand.
Um den Verdacht zu überprüfen, wurde eine Blutprobe veranlasst und dem Mann die Weiterfahrt untersagt.",https://polizei.brandenburg.de/pressemeldung/e-roller-fahrer-unter-drogenverdacht/5600500
Kellereinbruch,03.06.2025,"Lübbenau, Oberspreewald-Lausitz","Ein Kellereinbruch in der Straße des Aufbaus wurde der Polizei am Montagmittag gemeldet. Unbekannte hatten hier aus einem Abteil unter anderem ein E-Bike gestohlen.
Nach dem Rad der Marke ""Winora"" wird nun gefahndet.",https://polizei.brandenburg.de/pressemeldung/kellereinbruch/5600492
Zigaretten aus Discounter gestohlen,03.06.2025,"Großräschen, Oberspreewald-Lausitz","Ein Kunde informierte die Mitarbeitenden eines Discounters am Montagnachmittag darüber, dass er mehrere Personen dabei beobachtet hatte, wie sie die Zigarettenbox an der Kasse geöffnet und mehrere Zigarettenschachteln eingepackt hatten. Eine Mitarbeiterin nahm daraufhin die Verfolgung auf und konnte beobachten, wie die Personen am Bahnhof in ein Auto stiegen und wegfuhren.
Die hinzugerufenen Polizisten konnten das Fahrzeug trotz umfangreicher Suche nicht aufgreifen. Allerdings wurde bekannt, dass in einem anderen Discounter in Senftenberg ebenfalls eine Personengruppe im Kassenbereich aufgefallen war, die sich offenbar von den Mitarbeitern beobachtet gefühlt und von ihrer Tat abgelassen hatten. Die Ermittlungen der Kriminalpolizei dauern an.",https://polizei.brandenburg.de/pressemeldung/zigaretten-aus-discounter-gestohlen/5600491
Fahrraddiebstahl,03.06.2025,"Senftenberg, Oberspreewald-Lausitz","Statt ihres Fahrrades fand eine Frau am Dienstag gegen 10:15 Uhr in der Briesker Straße nur noch Reste des Schlosses.
Von dem ""Cube"" fehlte jede Spur, es wird nun in Fahndung gesetzt.",https://polizei.brandenburg.de/pressemeldung/fahrraddiebstahl/5600490
Kompletträder gestohlen,03.06.2025,"Schönefeld, Dahme-Spreewald","Ein Diebstahl in der Tiefgarage in Alt Schönefeld wurde der Polizei am Dienstagvormittag angezeigt. In den frühen Morgenstunden hatten Kriminelle von einem PKW MERCEDES alle vier Kompletträder gestohlen und den SUV auf Betonsteine aufgebockt.
Es wurde ein Schaden im fünfstelligen Eurobereich verursacht. Nach einer ersten Spurensicherung hat inzwischen die Kriminalpolizei weiterführende Ermittlungen übernommen.",https://polizei.brandenburg.de/pressemeldung/komplettraeder-gestohlen/5600471
Graffiti auf der Baustelle,03.06.2025,"Jamlitz, Dahme-Spreewald","Auf einer Baustelle in der Brauereistraße Richtung Mochlitz trieben am vergangenen Wochenende Graffiti-Sprayer ihr Unwesen, wie der Polizei am Montagnachmittag angezeigt wurde. Bauwagen, Container und ein Notstromaggregat waren mit Symbolen und Tag’s eines Fußballclubs verunziert worden, deren Beseitigung mit mindestens 1.000 Euro zu Buche schlagen wird.
Inzwischen hat die Kriminalpolizei Ermittlungen zu der Sachbeschädigung aufgenommen.",https://polizei.brandenburg.de/pressemeldung/graffiti-auf-der-baustelle/5600467
Autodiebstahl,03.06.2025,"Waßmannsdorf, Dahme-Spreewald","Der Besitzer eines PKW MERCEDES meldete der Polizei am Montag, dass sein Auto, das vor dem S-Bahnhof in der Albert-Kiekebusch-Straße geparkt war, gestohlen wurde.
Gleichzeitig mit der Anzeigenaufnahme wurde die internationale Fahndung nach dem grauen Modell SL500 eingeleitet.",https://polizei.brandenburg.de/pressemeldung/autodiebstahl/5600466
Fluchtversuch nach positivem Drogentest,03.06.2025,"Cottbus, Cottbus","Polizeibeamte kontrollierten am Montag gegen 21:30 Uhr in der Schillerstraße einen PKW FORD. Der Fahrer konnte keinen Führerschein vorweisen, weil er keinen hat. Ein Drogenvortest schlug positiv auf Kokain an. Daraufhin wollte der Mann zu Fuß vor den Beamten fliehen.
Die konnten ihn allerdings festhalten und mit aufs Revier nehmen. Nach einer beweissichernden Blutentnahme durfte er wieder gehen. Allerdings zu Fuß und mit mehreren Anzeigen im Gepäck.",https://polizei.brandenburg.de/pressemeldung/fluchtversuch-nach-positivem-drogentest/5600457
Gestohlenes Auto wiedergefunden,03.06.2025,"Cottbus, Cottbus","Zeugen entdeckten in der Saspower Hauptstraße am Montagnachmittag einen PKW FORD, der in den Morgenstunden am Lindenplatz gestohlen worden war. Nachdem die Untersuchung an dem unbeschädigten Fahrzeug abgeschlossen war, konnte es dem rechtmäßigen Besitzer zurückgegeben werden.
Ausgangsmeldung:
Gleich mehrere Autodiebstähle musste die Polizei am Montagmorgen aufnehmen: Kurz nach 05:30 Uhr stellte die Besitzerin eines PKW KIA fest, dass ihr ""XCeed"" nicht mehr im Knappenweg in Spremberg stand. Bald darauf wurde der Diebstahl eines Firmenfahrzeugs am Lindenplatz in Cottbus bemerkt. Auch nach dem FORD ""Tourneo"" wird nun international gefahndet.",https://polizei.brandenburg.de/pressemeldung/gestohlenes-auto-wiedergefunden/5600456
Angebliche Autokäufer stehlen Fahrzeug,03.06.2025,"Cottbus, Cottbus","So hatte sich die Besitzerin eines VW ""Golf"" den Verkauf ihres Autos nicht vorgestellt. Sie hatte den 25 Jahre alten Wagen im Internet feilgeboten und auch Kaufinteressenten gefunden, die sich das Auto anschauen kamen. Die Besitzerin ging kurz ins Haus, um Unterlagen zu holen.
Währenddessen nutzen die angeblichen Käufer die Gelegenheit und fuhren mit dem grünen Golf einfach davon. Mit der Anzeigenaufnahme wurde die Fahndung nach dem Fahrzeug eingeleitet.",https://polizei.brandenburg.de/pressemeldung/angebliche-autokaeufer-stehlen-fahrzeug/5600450
Ohne Führerschein unterwegs,03.06.2025,"Cottbus, Cottbus","Polizeibeamte stoppten am Montagnachmittag im Schmellwitzer Weg einen PKW DACIA. Sie hatten den Fahrer erkannt und wussten, dass er keinen Führerschein hat. Und auch diesmal konnte er keinen vorzeigen.
Dafür zeigte ein Atemalkoholtest einen Wert von über anderthalb Promille an. Daher muss sich der Mann nun gleich mehrfach verantworten.",https://polizei.brandenburg.de/pressemeldung/ohne-fuehrerschein-unterwegs/5600449
